,Unnamed: 0,video_id,start,end,text,video_link,vid_path
2590,2590,jR_m23OHPWU.en,00:19:23.300,00:19:29.420, in the interior of piauí going through brazil talking about early treatment is a solution we,https://www.youtube.com/watch?v=jR_m23OHPWU.en,/Users/dumoura/Dev/PDev/PoliticalRemix/Lives_da_Semana/Notebook_IngDef/cache/subs/jR_m23OHPWU.en.vtt
2592,2592,jR_m23OHPWU.en,00:19:34.850,00:19:40.220, early treatment does not stay at home seek treatment immediately and,https://www.youtube.com/watch?v=jR_m23OHPWU.en,/Users/dumoura/Dev/PDev/PoliticalRemix/Lives_da_Semana/Notebook_IngDef/cache/subs/jR_m23OHPWU.en.vtt
14840,14840,Ea5ZK0Fr5TM.en,00:17:29.620,00:17:35.100, best practices of early treatment the early conduct of the doctor with my,https://www.youtube.com/watch?v=Ea5ZK0Fr5TM.en,/Users/dumoura/Dev/PDev/PoliticalRemix/Lives_da_Semana/Notebook_IngDef/cache/subs/Ea5ZK0Fr5TM.en.vtt
15568,15568,YCliiy_yl9Y.en,00:04:42.310,00:04:48.160, This is hydroxychloroquine ivermectin is setra for early treatment so,https://www.youtube.com/watch?v=YCliiy_yl9Y.en,/Users/dumoura/Dev/PDev/PoliticalRemix/Lives_da_Semana/Notebook_IngDef/cache/subs/YCliiy_yl9Y.en.vtt
15607,15607,YCliiy_yl9Y.en,00:08:19.530,00:08:24.000, vaccine who has to be contaminated has to go to early treatment,https://www.youtube.com/watch?v=YCliiy_yl9Y.en,/Users/dumoura/Dev/PDev/PoliticalRemix/Lives_da_Semana/Notebook_IngDef/cache/subs/YCliiy_yl9Y.en.vtt
18299,18299,ZZj93uz78NE.en,00:17:04.770,00:17:09.300, early treatment its your touching observation there that that you think,https://www.youtube.com/watch?v=ZZj93uz78NE.en,/Users/dumoura/Dev/PDev/PoliticalRemix/Lives_da_Semana/Notebook_IngDef/cache/subs/ZZj93uz78NE.en.vtt
18598,18598,ZZj93uz78NE.en,00:44:37.510,00:44:43.359, possible to diagnose and treat if we have early treatment that,https://www.youtube.com/watch?v=ZZj93uz78NE.en,/Users/dumoura/Dev/PDev/PoliticalRemix/Lives_da_Semana/Notebook_IngDef/cache/subs/ZZj93uz78NE.en.vtt
